{
  "$schema": "http://json-schema.org/draft-07/schema#",
  "$id": "finding.schema.json",
  "title": "Finding",
  "description": "A single accessibility issue reported by any agent (screen_reader, visual, motor, axe_baseline).",
  "type": "object",
  "required": [
    "finding_id",
    "element_ref",
    "agent",
    "issue_type",
    "wcag_criterion",
    "severity",
    "evidence",
    "confidence"
  ],
  "additionalProperties": false,
  "properties": {
    "finding_id": {
      "type": "string",
      "description": "UUID string, unique per finding."
    },
    "element_ref": {
      "type": "string",
      "description": "Matches a data-a11y-id injected into the DOM, format 'a11y-<int>'.",
      "pattern": "^a11y-[0-9]+$"
    },
    "agent": {
      "type": "string",
      "enum": ["screen_reader", "visual", "motor", "axe_baseline"]
    },
    "issue_type": {
      "type": "string",
      "description": "e.g. missing_alt, meaningless_alt, low_contrast, unreachable, small_target, focus_trap, illogical_tab_order",
      "minLength": 1
    },
    "wcag_criterion": {
      "type": "string",
      "description": "Must be present in wcag22_criteria.json, e.g. '1.1.1'.",
      "pattern": "^[0-9]+\\.[0-9]+\\.[0-9]+$"
    },
    "severity": {
      "type": "string",
      "enum": ["critical", "serious", "moderate", "minor"]
    },
    "evidence": {
      "type": "string",
      "description": "Short factual string describing what was actually observed.",
      "minLength": 1
    },
    "confidence": {
      "type": "number",
      "minimum": 0,
      "maximum": 1
    }
  }
}
